{
  "schema_version": 1,
  "story_id": "STORY-011",
  "run_id": "2026-09-14T09-12-26Z",
  "generated_at": "2026-09-14T09:12:26Z",
  "generator": "amigos 0.1.0",
  "findings_by_role": {
    "product": 16,
    "dev": 16,
    "qa": 15
  },
  "total_findings": 47,
  "distinct_findings": 23,
  "shared": 8,
  "unique": 15,
  "unique_by_role": {
    "product": 3,
    "dev": 6,
    "qa": 6
  },
  "split_added_nothing": false,
  "keys": [
    {
      "target_section": "dependencies",
      "risk_dimension": "dependency",
      "roles": [
        "product",
        "dev",
        "qa"
      ],
      "shared": true,
      "sources": [
        {
          "role": "product",
          "target_file": "constraints.md",
          "target_section": "Dependencies",
          "risk_dimension": "dependency",
          "statement": "Any check of state.json against git history assumes the file is committed and reachable from HEAD, which is false for a story whose first commit has not happened, for a freshly adopted repository, and after a rebase."
        },
        {
          "role": "dev",
          "target_file": "constraints.md",
          "target_section": "Dependencies",
          "risk_dimension": "dependency",
          "statement": "The only evidence that state.json's history was appended to rather than rewritten is git, and it is partial evidence. `git show HEAD:<path>` needs the file tracked and committed; a story mid-drafting has uncommitted transitions by design, so 'differs from HEAD' cannot be the signal the way it is for the four contract files. The check is unanswerable with no git, no work tree, or no committed state.json, and a rebase, `git commit --no-verify` or an amend rewrites the evidence. Enforcement outside the session is milestone task 3 and is explicitly not this story, so whatever lands here is in-session only."
        },
        {
          "role": "qa",
          "target_file": "constraints.md",
          "target_section": "## Dependencies",
          "risk_dimension": "dependency",
          "statement": "An append-only claim needs a baseline, and state.json is deliberately outside the two that exist: it is not in story.HASHED_FILES, so verify.baseline_revision() does not cover it, and dor.json.contract_hash does not hash it. Comparing against HEAD alone reopens exactly the laundering hole STORY-009 closed - an ordinary `git commit` makes the truncated history the baseline. The request does not say what the history is compared against."
        }
      ]
    },
    {
      "target_section": "desired outcome",
      "risk_dimension": "ambiguity",
      "roles": [
        "product",
        "dev"
      ],
      "shared": true,
      "sources": [
        {
          "role": "product",
          "target_file": "intent.md",
          "target_section": "Desired Outcome",
          "risk_dimension": "ambiguity",
          "statement": "The request says \"detects\" without saying whether detection refuses the action, reports it to a caller, or changes derived readiness, and those three produce different outcomes for the person the mechanism is meant to protect."
        },
        {
          "role": "dev",
          "target_file": "intent.md",
          "target_section": "Desired Outcome",
          "risk_dimension": "ambiguity",
          "statement": "'Working against blocked stories' has no settled referent. `dor.Result.state` distinguishes `ready`, `blocked` (a check failed) and the two withholding states, and `gate.decide()` already refuses a governed change under all three non-ready values with a reason naming which. So either the bullet is asking for something narrower than the gate already does \u2014 a distinct treatment of `blocked` specifically \u2014 or for something wider, and the two readings imply different mechanisms. Two careful readers will not agree on which was meant."
        }
      ]
    },
    {
      "target_section": "desired outcome",
      "risk_dimension": "testability",
      "roles": [
        "product",
        "qa"
      ],
      "shared": true,
      "sources": [
        {
          "role": "product",
          "target_file": "intent.md",
          "target_section": "Desired Outcome",
          "risk_dimension": "testability",
          "statement": "\"Working against a blocked story\" is not observable from a set of changed paths: the gate knows only the resolved active story, so a change made for a blocked story while a different ready story resolves is indistinguishable from legitimate work."
        },
        {
          "role": "qa",
          "target_file": "intent.md",
          "target_section": "## Desired Outcome",
          "risk_dimension": "testability",
          "statement": "No command is named. The ticket says 'which command reports it' is open, so every Then about detection is undecidable until one command, one output and one exit code are fixed. Today four commands touch state.json indirectly (check, status, verify, gate) and each has a different exit vocabulary; two reviewers running two of them would reach opposite verdicts on the same tampered file."
        }
      ]
    },
    {
      "target_section": "in scope",
      "risk_dimension": "scope",
      "roles": [
        "product",
        "dev",
        "qa"
      ],
      "shared": true,
      "sources": [
        {
          "role": "product",
          "target_file": "intent.md",
          "target_section": "In Scope",
          "risk_dimension": "scope",
          "statement": "The request bundles two of README phase 6's bullets (working against blocked stories, silently changing contract state) into one story without settling whether both must ship for milestone task 5 to be complete."
        },
        {
          "role": "product",
          "target_file": "intent.md",
          "target_section": "In Scope",
          "risk_dimension": "scope",
          "statement": "Running `amigos state <id> --set contract_change` leaves a history entry and is therefore not silent, so the request does not settle whether reopening a frozen contract should become harder or only unrecorded state change should become visible."
        },
        {
          "role": "product",
          "target_file": "intent.md",
          "target_section": "In Scope",
          "risk_dimension": "scope",
          "statement": "read_state() validates only declared_state and the type of history, never schemas/state.schema.json, so whether story_id, schema_version and unknown keys are part of \"hand-edited\" is undecided even though tests/test_dogfooding.py already asserts the schema for this repository's own stories."
        },
        {
          "role": "dev",
          "target_file": "intent.md",
          "target_section": "In Scope",
          "risk_dimension": "scope",
          "statement": "The ticket bundles two mechanisms that share only a README bullet list: state.json integrity (gap 8) and a mechanism for 'working against blocked stories' (phase 6 bullet 2, which the gap analysis never filed as a gap). They touch different modules, have separate decision surfaces, and neither depends on the other. Contracted together, the likely outcome is that state.json integrity lands and the blocked-story half is satisfied by a sentence. If they stay in one story, intent.md should say which one the story fails without."
        },
        {
          "role": "qa",
          "target_file": "intent.md",
          "target_section": "## In Scope",
          "risk_dimension": "scope",
          "statement": "The consequence of detection is undecided, and the two candidates have opposite effects. If detection only reports, gap 8 stays an unlock: gate._ready_before_change() fails open, so a hand-written contract_change still lifts a ready story's contract freeze and the report is advisory. If detection also refuses, the gate must consult the new check, which changes STORY-010's shipped behaviour. The request names neither."
        },
        {
          "role": "qa",
          "target_file": "intent.md",
          "target_section": "## In Scope",
          "risk_dimension": "scope",
          "statement": "README phase 6's second bullet, 'working against blocked stories', has no described mechanism. gate.decide() already refuses a governed change when the resolved story derives blocked, and names the failed checks. The request asks to 'give the bullet a mechanism' without saying what observable is missing today, so there is no way to tell whether this story adds behaviour or only pins existing behaviour as a regression."
        }
      ]
    },
    {
      "target_section": "invariants",
      "risk_dimension": "compatibility",
      "roles": [
        "product",
        "dev",
        "qa"
      ],
      "shared": true,
      "sources": [
        {
          "role": "product",
          "target_file": "constraints.md",
          "target_section": "Invariants",
          "risk_dimension": "compatibility",
          "statement": "STORY-010's contract freeze fails open on any story it cannot evaluate, so treating a tampered state.json as a structural error would turn tampering into a better unlock for contract edits than it is today."
        },
        {
          "role": "dev",
          "target_file": "constraints.md",
          "target_section": "Invariants",
          "risk_dimension": "compatibility",
          "statement": "STORY-010 is a committed, ready, frozen contract whose constraints.md states 'a story that cannot be evaluated stays editable' and whose acceptance.feature has the scenario 'A story whose contract cannot be evaluated stays editable'. If STORY-011 amends the fail-open rule so a tampered state.json refuses rather than releases, it contradicts a shipped contract and needs `amigos state STORY-010 --set contract_change` plus a re-contracting run. The ticket does not say whether that is in scope."
        },
        {
          "role": "dev",
          "target_file": "constraints.md",